{
  "manifest_id": "0d3a0000-0000-4000-8000-000000000501",
  "account_id": "0a0c0000-0000-4000-8000-000000000001",
  "opportunity_id": "0c0f0000-0000-4000-8000-000000000004",
  "episode": 2,
  "total": 4,
  "boundary": {
    "historical_start": 1,
    "historical_end": 3,
    "live_start": 4,
    "live_end": 4
  },
  "window": "historical",
  "state": {
    "version": 7,
    "as_of": "2026-09-28T14:30:00Z",
    "digest": "b1a2c3d4e5f60718293a4b5c6d7e8f90a1b2c3d4e5f60718293a4b5c6d7e8f90",
    "document": {
      "account_id": "0a0c0000-0000-4000-8000-000000000001",
      "version": 7,
      "account_name": "Acme Corp",
      "fields": {
        "health": { "known": true, "value": "stable" },
        "stage": { "known": true, "value": "evaluation" }
      }
    }
  },
  "knowledge": {
    "as_of": "2026-09-28T14:30:00.000001Z",
    "items": [
      {
        "id": "0b1e0000-0000-4000-8000-000000000701",
        "title": "After a reorg, wait for the owner to stabilize before commercial outreach",
        "status": "supported"
      },
      {
        "id": "0b1e0000-0000-4000-8000-000000000702",
        "title": "Security questionnaires stall without the SOC2 packet attached",
        "status": "candidate"
      }
    ]
  },
  "prior_episodes": [
    {
      "position": 1,
      "event_id": "0e7e0000-0000-4000-8000-000000000011",
      "occurred_at": "2026-09-22T09:10:00Z",
      "source_system": "crm",
      "provenance_origin": "dataset",
      "provenance": "crmarena-pro:b2b",
      "released": true,
      "held_out": false,
      "material": true,
      "account_change_id": "0a1c0000-0000-4000-8000-000000000301",
      "decision_episode_id": "0de50000-0000-4000-8000-000000000201",
      "state_version": 6,
      "graph_diff_id": 37,
      "no_action_reason": null,
      "coalesced": false
    },
    {
      "position": 2,
      "event_id": "0e7e0000-0000-4000-8000-000000000012",
      "occurred_at": "2026-09-28T14:30:00Z",
      "source_system": "email",
      "provenance_origin": "dataset",
      "provenance": "crmarena-pro:b2b",
      "released": true,
      "held_out": false,
      "material": false,
      "account_change_id": null,
      "decision_episode_id": null,
      "state_version": 7,
      "graph_diff_id": 40,
      "no_action_reason": "no_material_change",
      "coalesced": true
    }
  ],
  "next_event": {
    "position": 3,
    "event_id": "0e7e0000-0000-4000-8000-000000000013",
    "occurred_at": "2026-09-30T16:05:00Z",
    "source_system": "call",
    "provenance_origin": "dataset",
    "provenance": "crmarena-pro:b2b",
    "released": false,
    "held_out": false,
    "material": null,
    "account_change_id": null,
    "decision_episode_id": null,
    "state_version": null,
    "graph_diff_id": null,
    "no_action_reason": null,
    "coalesced": null
  },
  "can_previous": true,
  "can_play_next": true,
  "computed_at": "2026-10-04T05:00:00Z"
}
